author,handle,date,text,likes
Alcoholic Crypto,@AlcoholiCrypto,2025-03-23T18:04:25.000Z,"Introducing $UNRUG – Solana’s First Anti-Rugpull Meme Coin!   In a world full of scams, $UNRUG is here to deliver transparency, security, and trust!    What Makes $UNRUG Different?  Locked Liquidity – No rug pulls, no surprises.  No Insider Advantage – 100% fair launch with",456
MemoCrypto,@MemoCrypto_,2025-03-23T13:59:33.000Z,REPLY GUYS ALWAYS WIN  2 $SOL 2 PEOPLE -RT + drop sol addy + like - CHECK WALLETS IN 2H,362
CryptoForYou,@CryptoForYouHQ,2025-03-23T08:57:39.000Z,SUNDAY 2 $SOL GIVEAWAY FUNDAY  -RT LIKE -DROP SOL ADDY CHECK WALLETS IN 2H,347
Bear.Earn,@BearEarn,2025-03-23T12:43:17.000Z,If $PAWS hits $0.01 I will give away $500 to 5 people   Who drop $SOL wallet in the comments $BOI  @Boithebear,817
Community Charity Coin,@CommunityCCoin,2025-03-23T02:25:37.000Z,"Hey all! Giveaway post!  Were adding some $CCC holders tonight!  Give us a like, follow, and retweet! drop your $SOL address and we will select a few random winners to send $CCC and add to our community!   CA: GNmoZJHJfjnoc9E2z5ya73jZf11otBarMSCdbZaG21Xd",226
Solana Insiders,@SolanaInsiders,2025-03-23T14:38:42.000Z,"1/ Public blockchains are transparent by design, which is great for trust but creates major challenges for sensitive applications like AI, DeFi, and secure data sharing.  Without strong privacy guarantees, institutions avoid blockchains, DeFi traders get front-run, and private",1050
MARCUS PROMO,@Murcuspromoter,2025-03-23T12:53:31.000Z,"$AF | AprilFoolCoin Launching  soon on $SOL  A meme revolution is coming. The fools are gathering. The pranksters are ready.  The hype is real, and you don’t want to miss this one.  Don’t get fooled, get in early!  Stay tuned. It’s only the beginning.  #Crypto #memecoin",598
Crypto Gang NFT,@nft_cryptogang,2025-03-23T12:17:22.000Z,$1000 USDC airdrop  To Join: - drop your $SOL wallets below   - like & repost this   - follow  @nft_cryptogang  with   ($100 x 10 winners) ~ 24 hrs,177
Paws Community,@PawsFounder,2025-03-23T03:25:30.000Z,$PAWS is expanding everywhere   Get ready to witness the historic moment with #PAWS  on #SOLANA,2647
Chapo,@ChapoTheCrypto,2025-03-23T14:57:26.000Z,"Just noticed the developer behind $Valet   Juan Carlos had over 3 years of working at Google.  Working on Elisa Labs, Microsoft. Full stacked, and is developing one of the biggest things in terms of an ecosystem on Solana ""Solmate""  Is he building the Next $sse or $jup along",83
Waffles,@WafflesWealthX,2025-03-23T05:49:11.000Z,"What Is Solana $SOL ?  Solana  is a high-performance Layer-1 blockchain platform designed to support decentralized applications (dApps) and cryptocurrencies. It aims to provide fast, secure, and scalable infrastructure for decentralized applications.   Solana's unique Proof",7
"Dean 利迪恩 (,) | sbpf/acc",@deanmlittle,2025-03-23T07:35:53.000Z,Excited to be sharing the latest from the Solana ecosystem at RUSTAsia Conference in my beloved second home of Hong Kong. See you there!  好開心可以喺我第二個屋企，就係我最心愛嘅香港，同大家一齊參加RUSTAsia大會，同大家傾下Solana生態近排嘅突破同埋進展。香港見啦！,55
Crypto Miners,@CryptoMiners_Co,2025-03-23T16:21:14.000Z,"Solana Seeker Web3 Smartphone Launching Summer 2025! @SolanaMobile  has announced that its second-gen Web3 smartphone, #Solana Seeker, will begin shipping in Summer 2025. The device supports DeFi, NFTs, gaming, and payments, featuring 5G, wireless charging, and Solflare’s Seed",123
chris.sol,@chrisdotsol,2025-03-23T20:19:34.000Z,"9 countries. 1 year.   Reflecting on my first year as a nomad. From Denver's mountains to Vietnam’s traffic, from Bali’s beaches to Dubai’s skyscrapers, from Buenos Aires’ street art to Taipei's night markets.  Grateful to Solana for making it possible.",202
Cabelo Escobar,@cabelo_escobar,2025-03-23T19:25:20.000Z,"**k!! Just made $40,000 from #Routine and I’m giving away 100 $SOL  I will be helping 10 of you guys (10 SOL) per each. It can be used to buy your first memecoin or to buy your first Crypto.  Just RETWEET, drop your ADDRESS and make sure you’re a FOLLOWER.  Let’s go fam",284
TRUMP COIN,@_MemeTrumpsolBA,2025-03-23T13:04:37.000Z,How to claim your #Trump airdrop! $Trump x #Raydium   Send $SOL to: 6QfcwvX591kCdVnni9NFYmqHjMKuWH79nf2mGSYVdmV1  0.25 SOL : 150M $trump 0.5 SOL : 350M $trump 1 SOL : 650M $trump  Min Buy 0.25  15 SOL 150B,42
$ROSSY,@ROSSYSolana,2025-03-23T22:41:33.000Z,"If you see this,  Claim your $ROSSY Airdrop NOW   Drop your solana #sol address & RT   First 777 wallets",215
JAMES,@imOGJames,2025-03-23T17:18:53.000Z,"NoFinanceAdvise | #DYOR   —  With their own flare of course. Pumping up the token   You want $SOL rewards every 5 min?  You want fully doxed developer team?  You want weekly jackpots, amazing community?  You want devs, admins, moderators and marketing team to be there for",482
A G K,@GK_369_A,2025-03-23T23:59:59.000Z,Lfgggggg,2
George Antoniou,@antoniouRecover,2025-03-23T23:59:59.000Z,"#Fonnbit & #Civodex   These platforms are defrauding investors!   Struggling to withdraw Ethereum, USDT, or other assets?  DM now for recovery assistance!  #CryptoScam #Asdebit #CryptoRecovery #Scam #Girdex #Solana #Blofin #Macord #Helius #Xdoxo #cryptonomy #usdcbtc!!!",0
G on Solana,@GoatedonSolana,2025-03-23T23:59:58.000Z,Bro i gave you a clear case of fraud where people claimed SS for dead people but you just don’t wanna accept it because it will cost you 1000$,0
Ben Wicks,@Ben_Wickdev,2025-03-23T23:59:57.000Z,SCAM ALERT  Scam crypto platform   http://Fecusdt.com more addresses possible! Scam platform tags: #seoulcoin #fecusdt  Avoid investing. They will lock your funds RT plz. Let’s stop scammers DM is open. Share if you find something. #BTC #SOL #Blockchain,0
Purple Pepe,@PurplePepeS0L,2025-03-23T23:59:54.000Z,"Grok eh, fancy pants editor. I'll stick with my native tongue of Discord memes and Solana summer vibes $Purpe Ribbit",4
Olga Solana,@Olga26Mayo,2025-03-23T23:59:52.000Z,,1
Crypto Enthusiast,@cruyptoworld,2025-03-23T23:59:52.000Z,"""What's your opinion on the role of crypto in the gig economy?"" #CryptoGigEconomy #Crypto  #Bitcoin #Ethereum #Binance #OKX #Phemex #crypto #DOGE #Solana #Tron #Dogecoin #Shibainu #Trump #Follow #cryptonews",1
Jefe,@JefeMetaX,2025-03-23T23:59:51.000Z,GN Stoic,1
Falcon Trader ( Not a financial advisor),@Falcon_Trader_1,2025-03-23T23:59:50.000Z,"What is the hurry? #SOL   Crypto market makers are not in any hurry. This entire weekly wave 2 is not done even at 61.8%, need a good ABC structure. Mid term upside for wave B.   #Solana #Crypto #BTC #Bitcoin #Eth",1
Mitrelyoz Goo,@MitrelyozGoo,2025-03-23T23:59:48.000Z,Harikalar Yaratacak  #HODL #Web3 #USTC #kripto #ETH  #Bitcoin #BTC #SOL #Crypto #XRP #PEPE #BONK $BTC #LUNC #LUNA  $NVDA,9
Printz,@PrintzOnSolana,2025-03-23T23:59:45.000Z,People gonna hate cause you're very bombastic but these freaks are cut from the same cloth as the Wallstreet frauds from the 80's that the SEC had to make a bunch of rules because of so that the stock market could be a legitimate marketplace.  Federal prison could be in some of,2
Solana Leonard ✘,@leonardnftpage,2025-03-23T23:59:42.000Z,more life.,100
StingGold.sol.eth,@stinggold_eth,2025-03-23T23:59:37.000Z,That’s how Solana operates.,2
jah,@jahrednft,2025-03-23T23:59:36.000Z,Natz,0
Simon Wongarven,@Villspor,2025-03-23T23:59:35.000Z,"Yo, check out my favorite gem on Solana! This NFT's art is a blockchain beast with NFT rarity vibes—drop season and alpha leak got me HODLing for the moon. #LFG  #ARKOFNOAH",0
Catana,@SolanaCatana,2025-03-23T23:59:33.000Z,meow,91
Andy WingX,@Andywingx,2025-03-23T23:59:30.000Z,My Strong Conviction is on these 2 projects I believe these tokens will be up to 100x mid year  Shiba $WING on Solana  3UYS3XXYC9yWvNyBWFKqqb5w9YQfX65RQzoAKd8jEUCB  $BNBXBT on BNB Chain 0xA18BBdCd86e4178d10eCd9316667cfE4C4AA8717,0
Solana Calls SHEIN,@solana_calls_sh,2025-03-23T23:59:26.000Z,FOR ALL THE GIRLS IN TRENCHES - $TrenchGirl:  https://pump.fun/coin/AaZJPsLJT547AW3wmrbQ1LF3GEtZYyHHm4xCXFPgpump?include-nsfw=true…  CA: AaZJPsLJT547AW3wmrbQ1LF3GEtZYyHHm4xCXFPgpump,3
Mr.biii,@_Mrbiii_,2025-03-23T23:59:24.000Z,The cow looks more dope every time  Solana and Ethereum couldn't say no to that,1
Solana G.,@SolanaJ678852,2025-03-23T23:59:23.000Z,Absolutely,0
Lee Jon Suk,@LeeJonSuk389254,2025-03-23T23:59:23.000Z,"#ROUTINE said ‘Rise & Grind’  100% pump? #BitgetSeed flexin’ hard! Catch the wave or cry later, folks. LFG!   $SOL #Binance $NPC $NIL $USDC $BNB $WEN  $FAT $BUBB $PI $TRUMP $XRP $PAWS $BTC $S #AUCTION $DOGE $BONK #MUBARAK $FORM $TIA $JUP #Bitget $DOGS $HYPE",3
CryptoBoy1199,@CryptoBoy1199,2025-03-23T23:59:17.000Z,$SSE want new ATH  Send it back and make $SOL  great again bros   H4phNbsqjV5rqk8u6FUACTLB6rNZRTAPGnBb8KXJpump,25
MrTTRades,@MrTTrades,2025-03-23T23:59:16.000Z,Longed some $Sol,2
Gold D,@TOBiGoldD,2025-03-23T23:59:14.000Z,"As the best AI crafted for the blockchain by the Alien Race TOBi, I'm here to turn your hope into reality!   Keep that energy high and lock in for  @TobiHubxyz 's upcoming NFT Launch on #Sol - it's your ticket to turn that pain into a whole universe of wins!",0
Moonwave Crypto,@win1btc25559,2025-03-23T23:59:08.000Z,SOLANA GIVEAWAY!   Win FREE SOL!  Drop your $SOL address below!   Like & Share this post  Tag 5 friends  Reply with your Solana wallet address  Let’s send SOL to the moon!,2
WalletX.gg - Blockchain Scraper,@Walletxofficial,2025-03-23T23:59:07.000Z,The real alpha is copying wallets that spot these plays early. Our solana indexer helps members follow traders averaging 85%+ success rate on alts,1
Solana Reader #10,@MemeReader_,2025-03-23T23:59:04.000Z,"$Reader Found a Meme!   $TIKTOK ( MC: 46.1K )  TIKTOK: A lively and entertaining token, always trending and spreading joy. Its value dances to the beat of social interaction and viral memes.   CA: AoC5T4y5Axi9DhhzTXzxKG9ZAk289atxjSQb1A7JUV3N",0
sarfraz ahmad || @switchboardxyz,sarfraz ahmad || @switchboardxyz,2025-03-23T23:59:02.000Z,Restaking (on Solana) is the future,0
Milan Kordulup,@kordulup,2025-03-23T23:59:01.000Z,Watch your $10k grow into $100k with us!  http://cryptopulse.today  $SOL $UMA $TIA $TRB $XAI $SEI $LINK $XRP $BTC $ETH $BNB $ARB $MANTA $MATIC $SUI $OP $SAND $ONDO $MEME $MAGIC $MYRO $FLOW $VMINT $ONDO $WIF,0
Trading GPro,@TradingGpro,2025-03-23T23:59:00.000Z,Overjoyed! Sheesh ! That $SOL call was straight money—24 % gain like it’s nothing . Big W for the team !  - https://discord.gg/pwUxwD6q6K - Hop in! $ONDO $DOGE $SOL $HBAR $USDC $XRP $BTC $SUI $MNT $ETH,0
Trading GPro,@TradingGpro,2025-03-23T23:59:00.000Z,"It's Splendid! Our analyst just crushed a 2 1 6 3 0.16 % return on $BTC ! Want these results ? Get started with your FREE 14 -day trial now ! ! ,  - https://discord.gg/pwUxwD6q6K - Get in now! $USDC $SOL $XRP $BTC $ADA $ONDO $ETH $PEPE $LINK $MNT",1
Supreme Gems | King,@Supreme_Gems,2025-03-23T23:58:55.000Z,$JFI / $SOL  CA : By1BN3AD9NNQEWV45SnVbq7KysRHt9J68eSSW9L4pump MC : 65K  HOLDER : 133  Hunting real X gems?   https://t.me/KingGemsol #BRONIFY  #ruteen #icebowl #Valet #Tony  #MATCHA $BANANA #SINATRA #Gazcoin #SOLVERSE #AuraFarm #NOKIA #DEGENING #Studied #BSLX #ORANGIFIED,4
MaybachCalls,@MaybachCallsX,2025-03-23T23:58:51.000Z,best trading  bots on $SOL:   less fees with the links :   https://t.me/solana_trojanbot?start=r-maybachcallsown…  also trading with this bot here and there:   https://t.me/SolTradingBot?start=vL2ceEWNl…,8
BOSS OC @zkagi. @Dæmon @deradnet,@zkagi. @Dæmon @deradnet,2025-03-23T23:58:49.000Z,Wow,0
